{
  "$schema": "https://json-schema.org/draft/2020-12/schema",
  "title": "PrikBoard theme",
  "description": "A color theme for PrikBoard. Tokens are the CSS custom properties the app is drawn with (written without the leading --). A theme names a built-in theme in `extends` and lists only what it changes, or leaves `extends` out and lists every token. Values are plain CSS: colors, shadows or font families, never url(...) or other rules. See docs/themes.md.",
  "type": "object",
  "required": ["format", "id", "name", "colorScheme", "tokens"],
  "additionalProperties": false,
  "properties": {
    "$schema": { "type": "string" },
    "format": { "const": 1, "description": "The version of this file format." },
    "id": {
      "type": "string",
      "pattern": "^[a-z0-9][a-z0-9-]{0,39}$",
      "description": "A short id, lower case letters, digits and dashes. Stored per browser as the chosen theme, so keep it once people use the theme."
    },
    "name": { "type": "string", "minLength": 1, "maxLength": 40, "description": "The name shown in the theme picker." },
    "description": { "type": "string", "maxLength": 200, "description": "One line about the theme, shown with its name." },
    "colorScheme": {
      "enum": ["dark", "light"],
      "description": "Whether the page is dark or light: sets the browser's own controls (form fields, scroll bars) to match."
    },
    "extends": {
      "type": "string",
      "description": "The id of a built-in theme (productivity, positivity) whose tokens this one starts from."
    },
    "fonts": {
      "type": "array",
      "maxItems": 3,
      "items": { "type": "string", "pattern": "^[A-Z][A-Za-z0-9 ]{0,40}(:[a-z,]+@[0-9.,;]{1,80})?$" },
      "description": "Google Fonts families the font tokens use, as in a fonts.googleapis.com css2 link (\"Nunito:wght@400;500;600;700\"). Loaded from Google Fonts when the theme is picked, as Geist is. A theme that extends another keeps its fonts unless it lists its own."
    },
    "tokens": { "$ref": "#/$defs/tokens" },
    "bar": {
      "type": "object",
      "additionalProperties": false,
      "description": "Tokens that change on the top bar and the phone layout's bars, for a bar whose color differs from the page (Positivity's navy bars on a light page). Menus opened from a bar take the page's tokens again.",
      "properties": {
        "colorScheme": { "enum": ["dark", "light"], "description": "Whether the bars are dark or light." },
        "tokens": { "$ref": "#/$defs/tokens" }
      }
    }
  },
  "$defs": {
    "color": { "type": "string", "maxLength": 200, "description": "A CSS color, or var(--token) naming another token." },
    "shadow": { "type": "string", "maxLength": 200, "description": "A CSS box-shadow." },
    "font": { "type": "string", "maxLength": 200, "description": "A CSS font-family list." },
    "tokens": {
      "type": "object",
      "additionalProperties": false,
      "properties": {
        "bg": { "$ref": "#/$defs/color", "description": "The board and page background." },
        "bar": { "$ref": "#/$defs/color", "description": "The top bar and the phone layout's bars." },
        "bar-line": { "$ref": "#/$defs/color", "description": "The line under the top bar." },
        "panel": { "$ref": "#/$defs/color", "description": "Floating panels: the tool rail, minimap, zoom controls, menus." },
        "panel-2": { "$ref": "#/$defs/color", "description": "A panel inside a panel (fields, rows)." },
        "dialog": { "$ref": "#/$defs/color", "description": "Dialogs and windows (the expanded card, sheets)." },
        "dialog-line": { "$ref": "#/$defs/color", "description": "Edges of dialogs and windows." },
        "line": { "$ref": "#/$defs/color", "description": "Edges of panels, buckets and fields." },
        "line-strong": { "$ref": "#/$defs/color", "description": "Edges that need to stand out more (hovered fields, dividers)." },
        "text": { "$ref": "#/$defs/color", "description": "Main text." },
        "text-2": { "$ref": "#/$defs/color", "description": "Secondary text: labels, values on panels." },
        "text-body": { "$ref": "#/$defs/color", "description": "Running text, such as a text component's Markdown." },
        "muted": { "$ref": "#/$defs/color", "description": "Muted text and icons: bucket names, counts, inactive tools." },
        "subtle": { "$ref": "#/$defs/color", "description": "The faintest text: hints, placeholders, captions." },
        "hover": { "$ref": "#/$defs/color", "description": "Background of a hovered button or menu item." },
        "tool-hover": { "$ref": "#/$defs/color", "description": "Background of a hovered tool on the rail." },
        "row-hover": { "$ref": "#/$defs/color", "description": "Background of a hovered row in a list." },
        "accent": { "$ref": "#/$defs/color", "description": "The accent: selection outlines, the pressed tool, primary buttons, links." },
        "accent-ink": { "$ref": "#/$defs/color", "description": "Text and icons on an accent background." },
        "accent-bg": { "$ref": "#/$defs/color", "description": "A soft accent background: the pressed tool, chosen items." },
        "danger": { "$ref": "#/$defs/color", "description": "Text and icons for deleting and errors." },
        "danger-strong": { "$ref": "#/$defs/color", "description": "Background of a destructive button." },
        "bucket-bg": { "$ref": "#/$defs/color", "description": "A bucket in lists (the phone layout)." },
        "bucket-fill": { "$ref": "#/$defs/color", "description": "A bucket on the board. Keep it nearly opaque, so a bucket over another covers it." },
        "bucket-dot": { "$ref": "#/$defs/color", "description": "The dot grid inside a bucket." },
        "dot": { "$ref": "#/$defs/color", "description": "The dot grid on the board." },
        "mini-bg": { "$ref": "#/$defs/color", "description": "Background of small board previews." },
        "mini-dot": { "$ref": "#/$defs/color", "description": "The dots in small board previews." },
        "chip": { "$ref": "#/$defs/color", "description": "Background of counts and small chips." },
        "dim": { "$ref": "#/$defs/color", "description": "The veil over the page behind a dialog. Use a translucent color." },
        "minimap-bucket-fill": { "$ref": "#/$defs/color", "description": "Buckets in the minimap." },
        "slot": { "$ref": "#/$defs/color", "description": "Empty slots and drop places, such as the dashed avatar slot." },
        "halo": { "$ref": "#/$defs/color", "description": "The ring around an agent at work." },
        "float-shadow": { "$ref": "#/$defs/shadow", "description": "Shadow of floating panels (the rail, minimap, menus)." },
        "scrollbar-thumb": { "$ref": "#/$defs/color", "description": "Scroll bar thumbs." },
        "scrollbar-thumb-hover": { "$ref": "#/$defs/color", "description": "A hovered scroll bar thumb." },
        "scrollbar-track": { "$ref": "#/$defs/color", "description": "Scroll bar tracks on the canvases." },
        "window-shadow": { "$ref": "#/$defs/shadow", "description": "Shadow of windows over the board (the expanded card)." },
        "dialog-shadow": { "$ref": "#/$defs/shadow", "description": "Shadow of dialogs." },
        "avatar-bg": { "$ref": "#/$defs/color", "description": "Background of a person's initials." },
        "avatar-text": { "$ref": "#/$defs/color", "description": "A person's initials." },
        "avatar-more-bg": { "$ref": "#/$defs/color", "description": "Background of the +N avatar for more people." },
        "avatar-more-text": { "$ref": "#/$defs/color", "description": "Text of the +N avatar." },
        "agent-bg": { "$ref": "#/$defs/color", "description": "Background of agents' avatars, chips and badges." },
        "agent-text": { "$ref": "#/$defs/color", "description": "Text and icons on agents' avatars, chips and badges." },
        "discord-bg": { "$ref": "#/$defs/color", "description": "Background of a connected Discord server's badge." },
        "discord-text": { "$ref": "#/$defs/color", "description": "Text of a connected Discord server's badge." },
        "ink": { "$ref": "#/$defs/color", "description": "Text on cards (on every fill)." },
        "fill-butter": { "$ref": "#/$defs/color", "description": "The Butter card fill." },
        "fill-mint": { "$ref": "#/$defs/color", "description": "The Mint card fill." },
        "fill-sky": { "$ref": "#/$defs/color", "description": "The Sky card fill." },
        "fill-coral": { "$ref": "#/$defs/color", "description": "The Coral card fill." },
        "fill-lilac": { "$ref": "#/$defs/color", "description": "The Lilac card fill." },
        "tone-butter": { "$ref": "#/$defs/color", "description": "Butter as text or an icon on a panel (the card tool). Make it deeper than the fill on a light theme." },
        "tone-mint": { "$ref": "#/$defs/color", "description": "Mint as text or an icon on a panel." },
        "tone-sky": { "$ref": "#/$defs/color", "description": "Sky as text or an icon on a panel." },
        "tone-coral": { "$ref": "#/$defs/color", "description": "Coral as text or an icon on a panel." },
        "tone-lilac": { "$ref": "#/$defs/color", "description": "Lilac as text or an icon on a panel." },
        "ghost-bg": { "$ref": "#/$defs/color", "description": "A ghost button's own background; transparent where its outline shows well enough." },
        "ink-chalk": { "$ref": "#/$defs/color", "description": "The Chalk pen, a near-white. Light themes keep the pastel pens as they are; the dark row (Ink to Violet) is for strokes that need contrast." },
        "ink-butter": { "$ref": "#/$defs/color", "description": "The Butter pen." },
        "ink-mint": { "$ref": "#/$defs/color", "description": "The Mint pen." },
        "ink-sky": { "$ref": "#/$defs/color", "description": "The Sky pen." },
        "ink-coral": { "$ref": "#/$defs/color", "description": "The Coral pen." },
        "ink-lilac": { "$ref": "#/$defs/color", "description": "The Lilac pen." },
        "ink-ink": { "$ref": "#/$defs/color", "description": "The Ink pen, for drawing over a card's fill." },
        "ink-ochre": { "$ref": "#/$defs/color", "description": "The Ochre pen, for drawing over a card's fill." },
        "ink-pine": { "$ref": "#/$defs/color", "description": "The Pine pen, for drawing over a card's fill." },
        "ink-ocean": { "$ref": "#/$defs/color", "description": "The Ocean pen, for drawing over a card's fill." },
        "ink-brick": { "$ref": "#/$defs/color", "description": "The Brick pen, for drawing over a card's fill." },
        "ink-violet": { "$ref": "#/$defs/color", "description": "The Violet pen, for drawing over a card's fill." },
        "font": { "$ref": "#/$defs/font", "description": "The font family of all text: one the page loads (Geist, Geist Mono, or one in `fonts`) or the device has." },
        "mono": { "$ref": "#/$defs/font", "description": "The monospace font family: tags, counts, readable ids." }
      }
    }
  }
}
