{
  "$schema": "./theme.schema.json",
  "format": 1,
  "id": "chalkboard",
  "name": "Chalkboard",
  "description": "Green slate in a wooden frame, written in chalk.",
  "colorScheme": "dark",
  "extends": "productivity",
  "fonts": [
    "Kalam:wght@400;700"
  ],
  "tokens": {
    "bg": "#22382b",
    "bar": "#8e5b30",
    "bar-line": "#6e4422",
    "panel": "#2c4637",
    "panel-2": "#304c3c",
    "dialog": "#2a4434",
    "dialog-line": "#4e6a59",
    "line": "rgba(244, 241, 232, 0.3)",
    "line-strong": "rgba(244, 241, 232, 0.45)",
    "text": "#f4f1e8",
    "text-2": "#e6ebe2",
    "text-body": "#ecefe7",
    "muted": "#c7d3c8",
    "subtle": "#a9b8ab",
    "hover": "#355141",
    "tool-hover": "#3a5847",
    "row-hover": "#31493a",
    "accent": "#f5d65c",
    "accent-ink": "#1e2b23",
    "accent-bg": "rgba(245, 214, 92, 0.18)",
    "danger": "#ff9b8f",
    "danger-strong": "#d9534a",
    "bucket-bg": "rgba(38, 61, 47, 0.8)",
    "bucket-fill": "rgba(38, 61, 47, 0.97)",
    "bucket-dot": "rgba(255, 255, 255, 0.06)",
    "dot": "rgba(255, 255, 255, 0.09)",
    "mini-bg": "#1d3125",
    "mini-dot": "rgba(255, 255, 255, 0.08)",
    "chip": "rgba(244, 241, 232, 0.14)",
    "dim": "rgba(14, 24, 18, 0.78)",
    "minimap-bucket-fill": "#3e5c4a",
    "slot": "#5a7a66",
    "halo": "#c9b0ff",
    "float-shadow": "0 3px 0 rgba(0, 0, 0, 0.2), 0 12px 28px rgba(0, 0, 0, 0.35)",
    "scrollbar-thumb": "#4a6a56",
    "scrollbar-thumb-hover": "#5a7d67",
    "scrollbar-track": "#1d3125",
    "window-shadow": "0 40px 100px rgba(0, 0, 0, 0.55)",
    "dialog-shadow": "0 24px 60px rgba(0, 0, 0, 0.45)",
    "avatar-bg": "#1e2b23",
    "avatar-text": "#f4f1e8",
    "avatar-more-bg": "#3e5c4a",
    "avatar-more-text": "#e6ebe2",
    "agent-bg": "#3d2f5a",
    "agent-text": "#e6dcff",
    "discord-bg": "#2f325e",
    "discord-text": "#d0d3ff",
    "ink": "#1e2b23",
    "fill-butter": "#f7e58b",
    "fill-mint": "#a8e6c3",
    "fill-sky": "#a9d4f2",
    "fill-coral": "#f6a99a",
    "fill-lilac": "#d2bff2",
    "ink-chalk": "#f4f1e8",
    "ink-butter": "#f7e58b",
    "ink-mint": "#a8e6c3",
    "ink-sky": "#a9d4f2",
    "ink-coral": "#f6a99a",
    "ink-lilac": "#d2bff2",
    "font": "Kalam, ui-rounded, system-ui, sans-serif"
  },
  "bar": {
    "colorScheme": "dark",
    "tokens": {
      "text": "#fff4df",
      "text-2": "#f3e2c4",
      "text-body": "#fff4df",
      "muted": "#e8cfa8",
      "subtle": "#d9bc8f",
      "hover": "rgba(255, 244, 223, 0.12)",
      "tool-hover": "rgba(255, 244, 223, 0.16)",
      "line": "#a87444",
      "line-strong": "#b8844f",
      "panel": "#7a4d27",
      "chip": "rgba(255, 244, 223, 0.16)",
      "accent": "#f5d65c",
      "accent-ink": "#3b2414",
      "accent-bg": "#6e4422",
      "avatar-more-bg": "#6e4422",
      "ghost-bg": "transparent"
    }
  }
}
