{
  "$schema": "./theme.schema.json",
  "format": 1,
  "id": "productivity",
  "name": "Productivity",
  "description": "Dark, calm and low glare. The cards carry the color.",
  "colorScheme": "dark",
  "tokens": {
    "bg": "#0e1014",
    "bar": "#111318",
    "bar-line": "#1f242d",
    "panel": "#161a21",
    "panel-2": "#171b22",
    "dialog": "#14171d",
    "dialog-line": "#2a303b",
    "line": "#262b35",
    "line-strong": "#303644",
    "text": "#e6e8ec",
    "text-2": "#c9ced8",
    "text-body": "#d3d7de",
    "muted": "#9aa3b2",
    "subtle": "#8b94a5",
    "hover": "#1d222b",
    "tool-hover": "#232833",
    "row-hover": "#1a1e26",
    "accent": "#7cc4ff",
    "accent-ink": "#0e1622",
    "accent-bg": "#263142",
    "danger": "#ff8a80",
    "danger-strong": "#e5484d",
    "bucket-bg": "rgba(20, 23, 29, 0.8)",
    "bucket-fill": "rgba(20, 23, 29, 0.97)",
    "bucket-dot": "rgba(255, 255, 255, 0.06)",
    "dot": "rgba(255, 255, 255, 0.1)",
    "mini-bg": "#111419",
    "mini-dot": "rgba(255, 255, 255, 0.08)",
    "chip": "#1d222b",
    "dim": "rgba(7, 8, 11, 0.78)",
    "minimap-bucket-fill": "#2a303b",
    "slot": "#3a4150",
    "halo": "#c4a7ff",
    "float-shadow": "0 12px 32px rgba(0, 0, 0, 0.45)",
    "scrollbar-thumb": "#3a4150",
    "scrollbar-thumb-hover": "#4a5265",
    "scrollbar-track": "#111318",
    "window-shadow": "0 40px 100px rgba(0, 0, 0, 0.6)",
    "dialog-shadow": "0 24px 60px rgba(0, 0, 0, 0.5)",
    "avatar-bg": "#20242c",
    "avatar-text": "#e6e8ec",
    "avatar-more-bg": "#2e3441",
    "avatar-more-text": "#c9ced8",
    "agent-bg": "#2a2140",
    "agent-text": "#d9c9ff",
    "discord-bg": "#262a52",
    "discord-text": "#c9cdff",
    "ink": "#17181b",
    "fill-butter": "#f3d77a",
    "fill-mint": "#9fe0c0",
    "fill-sky": "#9ccbf5",
    "fill-coral": "#f4a99a",
    "fill-lilac": "#cdb8f5",
    "tone-butter": "var(--fill-butter)",
    "tone-mint": "var(--fill-mint)",
    "tone-sky": "var(--fill-sky)",
    "tone-coral": "var(--fill-coral)",
    "tone-lilac": "var(--fill-lilac)",
    "ghost-bg": "transparent",
    "ink-chalk": "#e6e8ec",
    "ink-butter": "#f3d77a",
    "ink-mint": "#9fe0c0",
    "ink-sky": "#9ccbf5",
    "ink-coral": "#ff8a73",
    "ink-lilac": "#cdb8f5",
    "ink-ink": "#17181b",
    "ink-ochre": "#7a5a00",
    "ink-pine": "#1f6249",
    "ink-ocean": "#1d5a8c",
    "ink-brick": "#963528",
    "ink-violet": "#663d8f",
    "font": "Geist, ui-sans-serif, system-ui, sans-serif",
    "mono": "'Geist Mono', ui-monospace, monospace"
  }
}
