{
  "$schema": "./theme.schema.json",
  "format": 1,
  "id": "cloud",
  "name": "Cloud",
  "description": "Soft periwinkle and pastels with puffy shadows.",
  "colorScheme": "light",
  "extends": "positivity",
  "fonts": [
    "Quicksand:wght@400;500;600;700"
  ],
  "tokens": {
    "bg": "#eef0fb",
    "bar": "#5b63b7",
    "bar-line": "#4f57a6",
    "panel": "#fbfbff",
    "panel-2": "#f3f4fd",
    "dialog": "#fbfbff",
    "dialog-line": "#d4d8f1",
    "line": "#d9dcf3",
    "line-strong": "#c3c8ec",
    "text": "#2f3570",
    "text-2": "#3a4080",
    "text-body": "#3a4080",
    "muted": "#535a92",
    "subtle": "#636aa0",
    "hover": "#e6e8fa",
    "tool-hover": "#dfe2f8",
    "row-hover": "#eceefc",
    "accent": "#5a49e8",
    "accent-ink": "#ffffff",
    "accent-bg": "#e3e0ff",
    "danger": "#b3304a",
    "danger-strong": "#d4513f",
    "bucket-bg": "rgba(251, 251, 255, 0.8)",
    "bucket-fill": "rgba(251, 251, 255, 0.96)",
    "bucket-dot": "rgba(91, 99, 183, 0.08)",
    "dot": "rgba(91, 99, 183, 0.2)",
    "mini-bg": "#f4f5fd",
    "mini-dot": "rgba(91, 99, 183, 0.12)",
    "chip": "#e3e0ff",
    "dim": "rgba(238, 240, 251, 0.8)",
    "minimap-bucket-fill": "#dfe2f6",
    "slot": "#a3a8d6",
    "halo": "#ff8cc6",
    "float-shadow": "0 10px 30px rgba(91, 99, 183, 0.2), 0 1px 2px rgba(91, 99, 183, 0.12)",
    "scrollbar-thumb": "#c3c8ec",
    "scrollbar-thumb-hover": "#a3a8d6",
    "scrollbar-track": "#e6e8fa",
    "window-shadow": "0 40px 100px rgba(91, 99, 183, 0.3)",
    "dialog-shadow": "0 24px 60px rgba(91, 99, 183, 0.26)",
    "avatar-bg": "#5b63b7",
    "avatar-text": "#ffffff",
    "avatar-more-bg": "#4f57a6",
    "avatar-more-text": "#ffffff",
    "agent-bg": "#ffe0ef",
    "agent-text": "#b03a78",
    "discord-bg": "#e0e3ff",
    "discord-text": "#343a8f",
    "ink": "#2a2f5c",
    "fill-butter": "#fde59a",
    "fill-mint": "#bdeccf",
    "fill-sky": "#bcd3ff",
    "fill-coral": "#ffc2b3",
    "fill-lilac": "#dccbff",
    "tone-butter": "#a07a00",
    "tone-mint": "#26805a",
    "tone-sky": "#3a64c8",
    "tone-coral": "#c84a33",
    "tone-lilac": "#6a47c8",
    "ghost-bg": "rgba(255, 255, 255, 0.6)",
    "ink-chalk": "#2f3570",
    "ink-butter": "#c79a00",
    "ink-mint": "#2f9a66",
    "ink-sky": "#3f6fe0",
    "ink-coral": "#e0573f",
    "ink-lilac": "#7a55e0",
    "font": "Quicksand, ui-rounded, system-ui, sans-serif"
  },
  "bar": {
    "colorScheme": "dark",
    "tokens": {
      "text": "#ffffff",
      "text-2": "#eef0ff",
      "text-body": "#ffffff",
      "muted": "#d5d8f5",
      "subtle": "#c3c7ee",
      "hover": "rgba(255, 255, 255, 0.12)",
      "tool-hover": "rgba(255, 255, 255, 0.16)",
      "line": "#6c74c4",
      "line-strong": "#7a82cf",
      "panel": "#6a72c2",
      "chip": "rgba(255, 255, 255, 0.16)",
      "accent": "#ffffff",
      "accent-ink": "#5b63b7",
      "accent-bg": "#6c74c4",
      "avatar-more-bg": "#6c74c4",
      "ghost-bg": "transparent"
    }
  }
}
