{
  "$schema": "./theme.schema.json",
  "format": 1,
  "id": "sorbet",
  "name": "Sorbet",
  "description": "Cream paper, deep teal bars and a tomato accent.",
  "colorScheme": "light",
  "extends": "positivity",
  "fonts": [
    "Nunito:wght@400;500;600;700"
  ],
  "tokens": {
    "bg": "#fbf0e4",
    "bar": "#12394a",
    "bar-line": "#0c2c3a",
    "panel": "#fffaf3",
    "panel-2": "#f8ecdd",
    "dialog": "#fffaf3",
    "dialog-line": "#e6cfb6",
    "line": "#ecd8c3",
    "line-strong": "#e0c7ae",
    "text": "#12394a",
    "text-2": "#1d4a5c",
    "text-body": "#1d4a5c",
    "muted": "#4f6469",
    "subtle": "#5d7177",
    "hover": "#f6e7d6",
    "tool-hover": "#f8e6d4",
    "row-hover": "#f9eee2",
    "accent": "#cf4325",
    "accent-ink": "#ffffff",
    "accent-bg": "#ffdccd",
    "danger": "#b3261e",
    "danger-strong": "#d9342b",
    "bucket-bg": "rgba(255, 250, 243, 0.8)",
    "bucket-fill": "rgba(255, 250, 243, 0.97)",
    "bucket-dot": "rgba(196, 92, 58, 0.1)",
    "dot": "rgba(196, 92, 58, 0.24)",
    "mini-bg": "#fff6ec",
    "mini-dot": "rgba(196, 92, 58, 0.14)",
    "chip": "#ffe2d4",
    "dim": "rgba(251, 240, 228, 0.8)",
    "minimap-bucket-fill": "#f1dcc6",
    "slot": "#c9a98a",
    "halo": "#f07aa8",
    "float-shadow": "0 3px 0 rgba(18, 57, 74, 0.1), 0 14px 30px rgba(150, 80, 40, 0.16)",
    "scrollbar-thumb": "#e0c7ae",
    "scrollbar-thumb-hover": "#c9a98a",
    "scrollbar-track": "#f6e7d6",
    "window-shadow": "0 40px 100px rgba(120, 60, 30, 0.28)",
    "dialog-shadow": "0 24px 60px rgba(120, 60, 30, 0.24)",
    "avatar-bg": "#12394a",
    "avatar-text": "#fff4e6",
    "avatar-more-bg": "#1d4a5c",
    "avatar-more-text": "#fff4e6",
    "agent-bg": "#ffd3e4",
    "agent-text": "#a3245f",
    "discord-bg": "#e3e1fb",
    "discord-text": "#3a3f9a",
    "ink": "#1b2a33",
    "fill-butter": "#f8c93e",
    "fill-mint": "#9bd8bd",
    "fill-sky": "#9ab6ee",
    "fill-coral": "#ff8c6e",
    "fill-lilac": "#c9b4f4",
    "tone-butter": "#a87400",
    "tone-mint": "#1e7a5a",
    "tone-sky": "#3460b8",
    "tone-coral": "#c8401f",
    "tone-lilac": "#7a4fc4",
    "ghost-bg": "rgba(255, 255, 255, 0.5)",
    "font": "Nunito, ui-rounded, system-ui, sans-serif"
  },
  "bar": {
    "colorScheme": "dark",
    "tokens": {
      "text": "#fff4e6",
      "text-2": "#f3e2cf",
      "text-body": "#fff4e6",
      "muted": "#a9c6cc",
      "subtle": "#93b3ba",
      "hover": "rgba(255, 244, 230, 0.1)",
      "tool-hover": "rgba(255, 244, 230, 0.14)",
      "line": "#2a5468",
      "line-strong": "#346276",
      "panel": "#1b4a5e",
      "chip": "rgba(255, 244, 230, 0.12)",
      "accent": "#ff8c6e",
      "accent-ink": "#12394a",
      "accent-bg": "#2a5468",
      "avatar-more-bg": "#2a5468",
      "ghost-bg": "transparent"
    }
  }
}
