{
  "$schema": "./theme.schema.json",
  "format": 1,
  "id": "bubblegum",
  "name": "Bubblegum",
  "description": "Blush pink, berry bars and candy-colored cards.",
  "colorScheme": "light",
  "extends": "positivity",
  "fonts": [
    "Fredoka:wght@400;500;600"
  ],
  "tokens": {
    "bg": "#fde8e6",
    "bar": "#7a1f47",
    "bar-line": "#651a3b",
    "panel": "#fff6f6",
    "panel-2": "#fdeeee",
    "dialog": "#fff6f6",
    "dialog-line": "#f0c3c9",
    "line": "#f5cfd3",
    "line-strong": "#edb9c0",
    "text": "#5a1835",
    "text-2": "#6e2244",
    "text-body": "#6e2244",
    "muted": "#7d4a5d",
    "subtle": "#8d5568",
    "hover": "#fde0e3",
    "tool-hover": "#fbd6db",
    "row-hover": "#fdeaec",
    "accent": "#c8325d",
    "accent-ink": "#ffffff",
    "accent-bg": "#ffd6e0",
    "danger": "#b3261e",
    "danger-strong": "#d63c4a",
    "bucket-bg": "rgba(255, 246, 246, 0.8)",
    "bucket-fill": "rgba(255, 246, 246, 0.97)",
    "bucket-dot": "rgba(214, 76, 110, 0.1)",
    "dot": "rgba(214, 76, 110, 0.22)",
    "mini-bg": "#fff0f0",
    "mini-dot": "rgba(214, 76, 110, 0.14)",
    "chip": "#ffd6e0",
    "dim": "rgba(253, 232, 230, 0.8)",
    "minimap-bucket-fill": "#f7d3d8",
    "slot": "#d79aa8",
    "halo": "#8f86ff",
    "float-shadow": "0 3px 0 rgba(122, 31, 71, 0.1), 0 14px 30px rgba(214, 76, 110, 0.18)",
    "scrollbar-thumb": "#edb9c0",
    "scrollbar-thumb-hover": "#d79aa8",
    "scrollbar-track": "#fbe0e2",
    "window-shadow": "0 40px 100px rgba(122, 31, 71, 0.26)",
    "dialog-shadow": "0 24px 60px rgba(122, 31, 71, 0.22)",
    "avatar-bg": "#7a1f47",
    "avatar-text": "#fff0f3",
    "avatar-more-bg": "#8e2c5a",
    "avatar-more-text": "#fff0f3",
    "agent-bg": "#e4e1ff",
    "agent-text": "#4b3fb3",
    "discord-bg": "#e4e1ff",
    "discord-text": "#3a3f9a",
    "ink": "#3d1028",
    "fill-butter": "#f6c445",
    "fill-mint": "#b5e3c8",
    "fill-sky": "#a9b4f0",
    "fill-coral": "#f7837f",
    "fill-lilac": "#e9b2e6",
    "tone-butter": "#9a6a00",
    "tone-mint": "#2e7a52",
    "tone-sky": "#4553b8",
    "tone-coral": "#c7303c",
    "tone-lilac": "#8f3a9c",
    "ghost-bg": "rgba(255, 255, 255, 0.5)",
    "font": "Fredoka, ui-rounded, system-ui, sans-serif"
  },
  "bar": {
    "colorScheme": "dark",
    "tokens": {
      "text": "#fff0f3",
      "text-2": "#fbdde4",
      "text-body": "#fff0f3",
      "muted": "#f2b6c8",
      "subtle": "#e3a0b5",
      "hover": "rgba(255, 240, 243, 0.1)",
      "tool-hover": "rgba(255, 240, 243, 0.16)",
      "line": "#93345f",
      "line-strong": "#a2416c",
      "panel": "#8e2c5a",
      "chip": "rgba(255, 240, 243, 0.14)",
      "accent": "#ff9ab8",
      "accent-ink": "#5a1835",
      "accent-bg": "#93345f",
      "avatar-more-bg": "#93345f",
      "ghost-bg": "transparent"
    }
  }
}
