{
  "$schema": "./theme.schema.json",
  "format": 1,
  "id": "positivity",
  "name": "Positivity",
  "description": "Misty morning: a blue-grey board, navy bars and a blush warmth.",
  "colorScheme": "light",
  "extends": "productivity",
  "tokens": {
    "bg": "#c4cbd3",
    "bar": "#34465f",
    "bar-line": "#2b3a52",
    "panel": "#e3e7ec",
    "panel-2": "#dde2e8",
    "dialog": "#e8ebef",
    "dialog-line": "#b3bcc8",
    "line": "#b8c1cc",
    "line-strong": "#a3adba",
    "text": "#2b3a52",
    "text-2": "#34465f",
    "text-body": "#2f3d55",
    "muted": "#3f4a5c",
    "subtle": "#5a6679",
    "hover": "#d4dae1",
    "tool-hover": "#ccd3dc",
    "row-hover": "#d9dee5",
    "accent": "#3f5490",
    "accent-ink": "#ffffff",
    "accent-bg": "#c9d1e6",
    "danger": "#a8525e",
    "danger-strong": "#c4434e",
    "bucket-bg": "rgba(213, 219, 226, 0.8)",
    "bucket-fill": "rgba(213, 219, 226, 0.97)",
    "bucket-dot": "rgba(43, 58, 82, 0.08)",
    "dot": "rgba(43, 58, 82, 0.16)",
    "mini-bg": "#d5dbe2",
    "mini-dot": "rgba(43, 58, 82, 0.12)",
    "chip": "#d4dae1",
    "dim": "rgba(196, 203, 211, 0.8)",
    "minimap-bucket-fill": "#aab4c1",
    "slot": "#8592a5",
    "halo": "#6f5bb0",
    "float-shadow": "0 12px 32px rgba(43, 58, 82, 0.22)",
    "scrollbar-thumb": "#a3adba",
    "scrollbar-thumb-hover": "#8592a5",
    "scrollbar-track": "#cbd1d9",
    "window-shadow": "0 40px 100px rgba(43, 58, 82, 0.32)",
    "dialog-shadow": "0 24px 60px rgba(43, 58, 82, 0.28)",
    "avatar-bg": "#3f5490",
    "avatar-text": "#f2f4f8",
    "avatar-more-bg": "#34465f",
    "avatar-more-text": "#e3e7ec",
    "agent-bg": "#d7d1ec",
    "agent-text": "#45307e",
    "discord-bg": "#d3d7f2",
    "discord-text": "#343a8f",
    "ink": "#1f2b40",
    "fill-butter": "#f3dfa8",
    "fill-mint": "#c8e2d5",
    "fill-sky": "#dde7f3",
    "fill-coral": "#edc8c4",
    "fill-lilac": "#d7d1ec",
    "tone-butter": "#95690f",
    "tone-mint": "#2c7454",
    "tone-sky": "#3a66a3",
    "tone-coral": "#a8525e",
    "tone-lilac": "#64509f",
    "ghost-bg": "rgba(255, 255, 255, 0.4)",
    "ink-chalk": "#2b3a52",
    "ink-butter": "#b8892a",
    "ink-mint": "#3d8a68",
    "ink-sky": "#3f6fb0",
    "ink-coral": "#a8525e",
    "ink-lilac": "#6f5bb0"
  },
  "bar": {
    "colorScheme": "dark",
    "tokens": {
      "text": "#eef1f5",
      "text-2": "#d9dfe7",
      "text-body": "#e3e7ec",
      "muted": "#b7c1ce",
      "subtle": "#a1adbc",
      "hover": "rgba(255, 255, 255, 0.1)",
      "tool-hover": "rgba(255, 255, 255, 0.14)",
      "line": "#4a5d78",
      "line-strong": "#5a6d88",
      "panel": "#3d5170",
      "chip": "rgba(255, 255, 255, 0.12)",
      "accent": "#a9bcf0",
      "accent-ink": "#1f2b40",
      "accent-bg": "#44588a",
      "avatar-more-bg": "#4a5d78",
      "ghost-bg": "transparent"
    }
  }
}
