{
  "$schema": "./theme.schema.json",
  "format": 1,
  "id": "pool-party",
  "name": "Pool party",
  "description": "The dark playful one: pool blue, a bubblegum accent and bright cards.",
  "colorScheme": "dark",
  "extends": "productivity",
  "fonts": [
    "Rubik:wght@400;500;600;700"
  ],
  "tokens": {
    "bg": "#10324a",
    "bar": "#0a2333",
    "bar-line": "#0b2a3d",
    "panel": "#163f5a",
    "panel-2": "#1a4864",
    "dialog": "#133a53",
    "dialog-line": "#22506e",
    "line": "#22506e",
    "line-strong": "#2e6386",
    "text": "#eaf6ff",
    "text-2": "#cfe6f5",
    "text-body": "#dcecf7",
    "muted": "#93b5c8",
    "subtle": "#86a8bc",
    "hover": "#1d4b69",
    "tool-hover": "#215474",
    "row-hover": "#19455f",
    "accent": "#ff6fae",
    "accent-ink": "#2a0a1a",
    "accent-bg": "#4a2a55",
    "bucket-bg": "rgba(19, 57, 82, 0.8)",
    "bucket-fill": "rgba(19, 57, 82, 0.96)",
    "bucket-dot": "rgba(255, 255, 255, 0.07)",
    "dot": "rgba(255, 255, 255, 0.13)",
    "mini-bg": "#0e2c41",
    "mini-dot": "rgba(255, 255, 255, 0.1)",
    "chip": "#1f4c69",
    "dim": "rgba(6, 22, 33, 0.78)",
    "minimap-bucket-fill": "#22506e",
    "slot": "#3a6d8e",
    "halo": "#c9a7ff",
    "float-shadow": "0 3px 0 rgba(0, 0, 0, 0.2), 0 14px 32px rgba(0, 0, 0, 0.35)",
    "scrollbar-thumb": "#2e6386",
    "scrollbar-thumb-hover": "#3a759b",
    "scrollbar-track": "#0a2333",
    "window-shadow": "0 40px 100px rgba(0, 0, 0, 0.55)",
    "dialog-shadow": "0 24px 60px rgba(0, 0, 0, 0.45)",
    "avatar-bg": "#0a2333",
    "avatar-text": "#eaf6ff",
    "avatar-more-bg": "#22506e",
    "avatar-more-text": "#cfe6f5",
    "agent-bg": "#3d2a6b",
    "agent-text": "#e1d4ff",
    "discord-bg": "#2a2f6b",
    "discord-text": "#cdd0ff",
    "ink": "#10202c",
    "fill-butter": "#ffd23f",
    "fill-mint": "#5fe0b5",
    "fill-sky": "#6ec3ff",
    "fill-coral": "#ff8a65",
    "fill-lilac": "#c79bff",
    "ink-chalk": "#eaf6ff",
    "ink-butter": "#ffd23f",
    "ink-mint": "#5fe0b5",
    "ink-sky": "#6ec3ff",
    "ink-coral": "#ff8a65",
    "ink-lilac": "#c79bff",
    "font": "Rubik, ui-sans-serif, system-ui, sans-serif"
  }
}
